{
  "audit_mode": "triage",
  "manuscript_id": "abstract-only-001",
  "title": "Toward a broader way of thinking about satellite resilience",
  "abstract": "This perspective argues that future satellite resilience may require a new mindset that combines engineering, culture, and systems thinking. We suggest that traditional evaluation is too narrow and that a broader framework could eventually transform the field.",
  "manuscript_text": null,
  "figures_and_captions": null,
  "tables": null,
  "references": null,
  "supplement_or_appendix": null,
  "target_venue": "arXiv",
  "target_audience": "general aerospace readers",
  "outlet_profile_hint": "preprint_screen",
  "declared_article_type": "commentary_or_perspective",
  "data_availability": null,
  "code_availability": null,
  "materials_availability": null,
  "ethics_and_disclosures": null,
  "reporting_checklist": null,
  "prior_reviews": null,
  "author_response_to_reviews": null,
  "reviewer_notes": null,
  "external_constraints": null
}
