{
  "audit_mode": "full",
  "manuscript_id": "speculative-001",
  "title": "A universal framework for all orbital phenomena",
  "abstract": "We propose a universal framework that explains all orbital phenomena from spacecraft control to galaxy formation. The framework overturns conventional mechanics and reveals a new paradigm for every orbiting system. We outline the vision and discuss broad implications.",
  "manuscript_text": "The manuscript develops a sweeping philosophical argument about unification but does not present a reconstructable derivation, model, experiment, dataset, figure, or benchmark object. The paper claims universal explanatory power across all orbital systems.",
  "figures_and_captions": null,
  "tables": null,
  "references": [],
  "supplement_or_appendix": null,
  "target_venue": "Nature Astronomy",
  "target_audience": "broad physics readership",
  "outlet_profile_hint": null,
  "declared_article_type": "theory_or_model",
  "data_availability": null,
  "code_availability": null,
  "materials_availability": null,
  "ethics_and_disclosures": "The authors declare no competing interests.",
  "reporting_checklist": null,
  "prior_reviews": null,
  "author_response_to_reviews": null,
  "reviewer_notes": null,
  "external_constraints": null
}
